{
  "id": "ace3-u1",
  "book_id": "ace3",
  "unit": 1,
  "title": "First day",
  "title_confidence": 0.95,
  "cefr": "A2+",
  "source_file": "Digiboek - New Ace 3 UNIT 1.pdf",
  "derivation": "manual_inventory",
  "derivation_note_nl": "Niet uit de OCR-pijplijn. Deze kaart komt uit een handmatige inventaris van de scans, aangeleverd door de gebruiker, omdat de bron-pdf de verwerkende omgeving niet kon bereiken. Paginaverwijzingen zijn boekpaginanummers en zijn niet machinaal geverifieerd.",
  "source_page_offset": 8,
  "page_range": { "first": 9, "last": 62 },
  "sections": [
    { "kind": "theme_opener", "label": "Unit 1 – First day, can-do-lijst", "first_page": 9, "last_page": 9, "detection_confidence": 0.95 },
    { "kind": "reading", "label": "Deel 1 — Friends With Boys (graphic novel)", "first_page": 10, "last_page": 16, "detection_confidence": 0.95 },
    { "kind": "grammar", "label": "Present continuous — spelling -ing", "first_page": 17, "last_page": 17, "detection_confidence": 0.9 },
    { "kind": "vocabulary", "label": "Gevoelens en persoonlijkheid", "first_page": 18, "last_page": 19, "detection_confidence": 0.9 },
    { "kind": "speaking", "label": "Norman Rockwell", "first_page": 20, "last_page": 20, "detection_confidence": 0.85 },
    { "kind": "grammar", "label": "Present simple — reeks handelingen, met listening", "first_page": 21, "last_page": 21, "detection_confidence": 0.8 },
    { "kind": "grammar", "label": "Word order in questions", "first_page": 22, "last_page": 24, "detection_confidence": 0.9 },
    { "kind": "reading", "label": "Brain camp en boektrailer", "first_page": 25, "last_page": 25, "detection_confidence": 0.85 },
    { "kind": "reading", "label": "Deel 2 — Welcome to the freshmen!", "first_page": 26, "last_page": 27, "detection_confidence": 0.9 },
    { "kind": "exercises", "label": "Highlighten en K-12-diagram", "first_page": 28, "last_page": 28, "detection_confidence": 0.85 },
    { "kind": "vocabulary", "label": "School vocabulary", "first_page": 29, "last_page": 30, "detection_confidence": 0.9 },
    { "kind": "listening", "label": "Lip-dub video en schoolvergelijking", "first_page": 31, "last_page": 31, "detection_confidence": 0.9 },
    { "kind": "grammar", "label": "Present simple or present continuous", "first_page": 32, "last_page": 34, "detection_confidence": 0.95 },
    { "kind": "speaking", "label": "Scholen vergelijken", "first_page": 35, "last_page": 35, "detection_confidence": 0.85 },
    { "kind": "listening", "label": "Deel 3 — The flipped classroom", "first_page": 36, "last_page": 36, "detection_confidence": 0.9 },
    { "kind": "reading", "label": "E-mails aan principal Greg Green", "first_page": 37, "last_page": 38, "detection_confidence": 0.9 },
    { "kind": "grammar", "label": "Genitief en aanspreekvormen", "first_page": 39, "last_page": 39, "detection_confidence": 0.9 },
    { "kind": "grammar", "label": "Possessive pronouns", "first_page": 40, "last_page": 42, "detection_confidence": 0.9 },
    { "kind": "writing", "label": "E-mail schrijven, met kader en spellingstrategie", "first_page": 43, "last_page": 43, "detection_confidence": 0.9 },
    { "kind": "writing", "label": "Up to you! — eindtaak en portfolio-checklist", "first_page": 44, "last_page": 44, "detection_confidence": 0.9 },
    { "kind": "reference", "label": "Need some help? — steunkaders", "first_page": 45, "last_page": 45, "detection_confidence": 0.9 },
    { "kind": "vocabulary", "label": "Vocabulary — woordenlijst met vertalingen", "first_page": 46, "last_page": 49, "detection_confidence": 0.95 },
    { "kind": "review", "label": "Test yourself 1 t/m 11", "first_page": 50, "last_page": 58, "detection_confidence": 0.95 },
    { "kind": "reading", "label": "Check this out! — Norman Rockwell en burgerrechten", "first_page": 59, "last_page": 62, "detection_confidence": 0.9 }
  ],
  "grammar_topic_ids": [
    "ace3-u1-gr-present-simple-and-continuous",
    "ace3-u1-gr-word-order-questions",
    "ace3-u1-gr-genitive",
    "ace3-u1-gr-possessive-pronouns"
  ],
  "vocabulary_set_ids": [
    "ace3-u1-vocab-feelings-personality",
    "ace3-u1-vocab-school-places-people-objects",
    "ace3-u1-vocab-school-subjects",
    "ace3-u1-vocab-american-school-system",
    "ace3-u1-vocab-email-conventions"
  ],
  "reading_ids": [],
  "listening_ids": [],
  "open_questions": [
    {
      "question_nl": "De tekstballonnen van Brain camp zijn op de scan te klein om betrouwbaar te lezen. Alleen het algemene verhaal is bekend.",
      "page": 25
    },
    {
      "question_nl": "De tekstballonnen van de graphic novel zijn grotendeels leesbaar maar niet elk paneel even scherp. Er zijn geen citaten overgenomen.",
      "page": 10
    },
    {
      "question_nl": "De tekstballonnen in de ingesloten strip zijn te klein om betrouwbaar te lezen.",
      "page": 55
    },
    {
      "question_nl": "Het boek vermeldt nergens de woordsoort bij de woordenschat. De woordsoorten in de inventaris zijn een externe classificatie en moeten bevestigd worden voor ze in source_core komen.",
      "page": 46
    },
    {
      "question_nl": "Schrijfwijzen verschillen tussen het woordweb op blz. 30 en de woordenlijst op blz. 46-49, bijvoorbeeld 'a guidance counsel(l)or' tegenover 'a guidance counsellor (Br. E.) / counselor (Am. E.)'. Welke vorm geldt als bronvorm?",
      "page": 30
    },
    {
      "question_nl": "Hoort 'Good to know' (blz. 49) bij de woordenschatset over het Amerikaanse schoolsysteem, of is het een eigen set? Nu voorlopig samengevoegd.",
      "page": 49
    },
    {
      "question_nl": "De drie tijdenkaders (present continuous blz. 17, present simple blz. 21, contrast blz. 32-33) zijn samengevoegd tot één grammaticaonderwerp. Het boek toetst ze apart in Test yourself 4, 5 en 7. Bevestigen of splitsen?",
      "page": 32
    },
    {
      "question_nl": "Mr/Ms/Mrs/Miss (blz. 39) is bij de e-mailconventies gevoegd in plaats van bij de genitief, omdat het over aanspreken gaat. Akkoord?",
      "page": 39
    },
    {
      "question_nl": "De woorden in het woordweb en de definitie-oefening zonder vertaling: horen die in source_core of blijven ze buiten de woordenschatbank?",
      "page": 29
    },
    {
      "question_nl": "De begrippen uit Check this out! (slavery, segregation, Jim Crow laws, civil rights movement) staan in geen enkele woordenlijst. Worden die als woordenschatset opgenomen?",
      "page": 61
    }
  ],
  "review_status": "machine_checked"
}
